{
  "name": "Alex Morgan",
  "email": "alex@example.com",
  "phone": "+14155550100",
  "role": "Design",
  "bio": "Product designer in San Francisco.",
  "available": true,
  "photo": {
    "url": "https://images.unsplash.com/photo-1544005313-94ddf0286df2?auto=format&fit=crop&w=160&h=160&q=80",
    "alt": "Alex Morgan"
  }
}
